### ISSUE TITLE
Connection is poisoned: Cannot read framed message: Cannot read data: early eof

### ISSUE THREAD

**Issue by TaKO8Ki** [influxdata/rskafka#219]
I got the following error. Can I fix this error? Is this a bug?

rskafka version: 0.5.0
Apache Kafka version: 2.6.2

I use Amazon MSK and have three brokers.

source code:
```rust
use rskafka::{
    client::{ClientBuilder, SaslConfig},
};

let client =
    ClientBuilder::new(connection)
        .sasl_config(SaslConfig::Plain {
            username: sasl_username,
            password: sasl_password,
        });;

debug!("start building client");
let client = client.build().await?; // This line causes errors.
```

Errors:
```
Failed to connect to broker","e":"cannot sync versions: Request error: Connection is poisoned: Cannot read framed message: Cannot read data: early eof
```

**Comment by pdeva** [comment]
i am seeing this erros too...

**Comment by pdeva** [comment]
mine is failing on this:

```rust
 let (record, high_water_mark) = stream
            .next()
            .await
            .expect("some records")
            .expect("no error");
```

**Comment by TaKO8Ki** [comment]
I found that I need to use `SCRAM-SHA-512` as `sasl.mechanisms` in my case, so if I want to use rskafka, I have to implement `SCRAM-SHA-512` in [SaslConfig](https://github.com/influxdata/rskafka/blob/6fc44f5feaf9da913c785041c8b2d37111f346b2/src/connection/transport/sasl.rs#L2) probably. However I guess we may be able to improve rskafka to output more reasonable errors.

**Comment by pdeva** [comment]
i am not even using sasl at all but still getting the error

**Comment by crepererum** [comment]
Sounds like the broker is cutting the connection, probably due to some protocol error. The best thing to try is to capture the network traffic (e.g. w/ wireshark) and analyze it. My rough guess is that is a bit dated and it doesn't like the newer protocol versions that we use.

**Comment by MichaelScofield** [comment]
Got this error today when trying to working with Azure Event Hubs service.

I was simply running the test: `cargo test test_sasl`, and got this error msg:

```text
2025-08-29T09:48:28.220469Z  INFO rskafka::connection: Establishing new connection url="foo.servicebus.windows.net:9093"
2025-08-29T09:48:28.299333Z  WARN rskafka::connection: Failed to connect to broker e=cannot sync versions: Request error: Connection is poisoned: Cannot read framed message: Cannot read data: early eof
2025-08-29T09:48:28.299411Z  INFO rskafka::backoff: request encountered non-fatal error - backing off e=cannot sync versions: Request error: Connection is poisoned: Cannot read framed message: Cannot read data: early eof request_name="broker_connect" backoff_secs=0
```

I have captured the network traffic via tcpdump:

```text
08:53:04.438018 IP test.internal.cloudapp.net.40332 > 20.195.81.86.9093: Flags [S], seq 1637866040, win 64240, options [mss 1460,sackOK,TS val 979609268 ecr 0,nop,wscale 7], length 0
08:53:04.469209 IP 20.195.81.86.9093 > test.internal.cloudapp.net.40332: Flags [S.], seq 2809849037, ack 1637866041, win 65535, options [mss 1440,nop,wscale 8,sackOK,TS val 182380707 ecr 979609268], length 0
08:53:04.469231 IP test.internal.cloudapp.net.40332 > 20.195.81.86.9093: Flags [.], ack 1, win 502, options [nop,nop,TS val 979609300 ecr 182380707], length 0
08:53:04.469381 IP test.internal.cloudapp.net.40332 > 20.195.81.86.9093: Flags [P.], seq 1:38, ack 1, win 502, options [nop,nop,TS val 979609300 ecr 182380707], length 37
08:53:04.500069 IP 20.195.81.86.9093 > test.internal.cloudapp.net.40332: Flags [F.], seq 1, ack 38, win 16388, options [nop,nop,TS val 182380737 ecr 979609300], length 0
08:53:04.500193 IP test.internal.cloudapp.net.40332 > 20.195.81.86.9093: Flags [F.], seq 38, ack 2, win 502, options [nop,nop,TS val 979609331 ecr 182380737], length 0
08:53:04.530552 IP 20.195.81.86.9093 > test.internal.cloudapp.net.40332: Flags [.], ack 39, win 16388, options [nop,nop,TS val 182380768 ecr 979609331], length 0
08:53:04.603938 IP test.internal.cloudapp.net.40338 > 20.195.81.86.9093: Flags [S], seq 109114710, win 64240, options [mss 1460,sackOK,TS val 979609434 ecr 0,nop,wscale 7], length 0
```

It seems like the server actively closed the connection. But why?

Looking at the rskafka codes, the error has to be came up from doing the kafka `ApiVersionsRequest`:

```rust
let mut messenger = Messenger::new(BufStream::new(transport), max_message_size, client_id);
messenger.sync_versions().await?;
if let Some(sasl_config) = sasl_config {
    messenger.do_sasl(sasl_config).await?;
}
```

The `ApiVersionsRequest` is optional, maybe some cloud kafka service vendor just don't allow this? I guess they always want to do authentication at the very first.
